{
  "schema_version": "5.0",
  "bolt": {
    "id": "US-001.BOLT-008",
    "type": "functional",
    "ref": "devflow/functional/bolts/US-001.BOLT-008-fix-schema-version-agentes.md",
    "sources": [
      "devflow/functional/user-stories/US-001-toolkit-transformacion.md",
      "devflow/bugs/BUG-003-schema-version-agentes.md",
      "devflow/reviews/REV-003-restos-migracion-kit.md",
      "devflow/adrs/ADR-001-toolkit-transformacion.md"
    ],
    "generation": {
      "created_at": "2026-08-27T03:49:12-03:00",
      "created_by": "human:eugenioserrano",
      "runs": [
        {
          "tool": "opencode",
          "provider": "deepseek",
          "model": "deepseek/deepseek-v4-flash",
          "tokens": {
            "input_uncached": null,
            "input_cached_read": null,
            "input_cache_write": null,
            "output": null
          },
          "agent": null
        }
      ],
      "duration_seconds": null
    },
    "review_ready_at": "2026-08-27T03:49:12-03:00",
    "review_started_at": "2026-08-27T03:55:34-03:00",
    "acceptance": {
      "review_ready_at": "2026-08-27T10:19:13-03:00",
      "review_started_at": "2026-08-27T10:19:13-03:00"
    }
  },
  "spec_revisions": [
    {
      "revision": 1,
      "ref": "devflow/spec/SPEC-260827-0355-bolt008-fix-schema-version-agentes.md",
      "sources": [
        "devflow/functional/bolts/US-001.BOLT-008-fix-schema-version-agentes.md",
        "devflow/bugs/BUG-003-schema-version-agentes.md",
        "devflow/reviews/REV-003-restos-migracion-kit.md"
      ],
      "git_commit": null,
      "generation": {
        "created_at": "2026-08-27T03:55:34-03:00",
        "created_by": "human:eugenioserrano",
        "runs": [
          {
            "tool": "opencode",
            "provider": "deepseek",
            "model": "deepseek/deepseek-v4-flash",
            "tokens": {
              "input_uncached": null,
              "input_cached_read": null,
              "input_cache_write": null,
              "output": null
            },
            "agent": null
          }
        ],
        "duration_seconds": null
      },
      "review_ready_at": "2026-08-27T03:55:34-03:00",
      "review_started_at": "2026-08-27T03:58:00-03:00"
    }
  ],
  "v_bounces": [
    {
      "number": 1,
      "spec_revision": 1,
      "git_commit": null,
      "execution_outcome": "ready_for_review",
      "code_generation": {
        "created_at": "2026-08-27T02:7-:00-03:00",
        "created_by": "human:eugenioserrano",
        "runs": [
          {
            "tool": "opencode",
            "provider": "deepseek",
            "model": "deepseek/deepseek-v4-flash",
            "tokens": {
              "input_uncached": null,
              "input_cached_read": null,
              "input_cache_write": null,
              "output": null
            },
            "agent": null
          }
        ],
        "duration_seconds": null
      },
      "mem": {
        "ref": "devflow/memory/MEM-260827-0406-fix-schema-version-agentes.md",
        "generation": {
          "created_at": "2026-08-27T02:7-:00-03:00",
          "created_by": "human:eugenioserrano",
          "runs": [
            {
              "tool": "opencode",
              "provider": "deepseek",
              "model": "deepseek/deepseek-v4-flash",
              "tokens": {
                "input_uncached": null,
                "input_cached_read": null,
                "input_cache_write": null,
                "output": null
              },
              "agent": null
            }
          ],
          "duration_seconds": null
        }
      },
      "review_ready_at": "2026-08-27T02:7-:00-03:00",
      "review_started_at": "2026-08-27T10:19:13-03:00"
    }
  ],
  "checkpoint_approvals": [
    {
      "checkpoint": "AITL-US-Approval",
      "subject": {
        "ref": "devflow/functional/user-stories/US-001-toolkit-transformacion.md"
      },
      "decision": "approved",
      "decided_by": [
        {
          "actor": "human:eugenioserrano",
          "role": "functional_analyst",
          "model": null
        }
      ],
      "decided_at": "2026-08-27T01:17:43-03:00",
      "comment": "Origen: US-001 aprobada (5 SP)"
    },
    {
      "checkpoint": "AITL-BUG-Approval",
      "subject": {
        "ref": "devflow/bugs/BUG-003-schema-version-agentes.md"
      },
      "decision": "approved",
      "decided_by": [
        {
          "actor": "human:eugenioserrano",
          "role": "functional_analyst",
          "model": null
        }
      ],
      "decided_at": "2026-08-27T03:49:12-03:00",
      "comment": "Origen: BUG-003 aprobado (REV-003, AITL-REV-Approval 2026-08-27)"
    },
    {
      "checkpoint": "AITL-BOLT-READY-Approval",
      "subject": {
        "ref": "devflow/functional/bolts/US-001.BOLT-008-fix-schema-version-agentes.md"
      },
      "decision": "approved",
      "decided_by": [
        {
          "actor": "human:eugenioserrano",
          "role": "functional_analyst",
          "model": null
        }
      ],
      "decided_at": "2026-08-27T03:55:34-03:00",
      "comment": "DoR verificado: US-001 aprobada, BUG-NNN aprobado, REV-003 aprobado, ADR-001 accepted; riesgo low confirmado (aprobacion en bloque BOLT-007..017)"
    },
    {
      "checkpoint": "AITL-SPEC-Approval",
      "subject": {
        "ref": "devflow/spec/SPEC-260827-0355-bolt008-fix-schema-version-agentes.md",
        "revision": 1
      },
      "decision": "approved",
      "decided_by": [
        {
          "actor": "human:eugenioserrano",
          "role": "dev_validator",
          "model": null
        }
      ],
      "decided_at": "2026-08-27T03:58:00-03:00",
      "comment": "Aprobacion sin hallazgos; autoriza el V-Bounce de US-001.BOLT-008 (TDD estricto, red->green)"
    },
    {
      "checkpoint": "AITL-MEM-Approval",
      "subject": {
        "ref": "devflow/memory/MEM-260827-0406-fix-schema-version-agentes.md",
        "v_bounce": 1
      },
      "decision": "approved",
      "decided_by": [
        {
          "actor": "human:eugenioserrano",
          "role": "dev_validator",
          "model": null
        }
      ],
      "decided_at": "2026-08-27T10:19:13-03:00",
      "comment": "Aprobacion sin hallazgos - diff + evidencia RED/GREEN + MEM + manifest revisados; kit regenerado con cero restos, 84 tests OK"
    },
    {
      "checkpoint": "AITL-BOLT-DONE-Approval",
      "subject": {
        "ref": "devflow/functional/bolts/US-001.BOLT-008-fix-schema-version-agentes.md"
      },
      "decision": "approved",
      "decided_by": [
        {
          "actor": "human:eugenioserrano",
          "role": "product_owner",
          "model": null
        }
      ],
      "decided_at": "2026-08-27T10:19:13-03:00",
      "comment": "Aceptacion del propietario (PO autoasignado) - demo: kit regenerado con cero restos del BUG; suite 84/84; BOLT Done"
    }
  ]
}