{
  "schema_version": "5.0",
  "bolt": {
    "id": "US-000.BOLT-011",
    "type": "non-functional",
    "ref": "devflow/functional/bolts/US-000.BOLT-011-kit-self-containment.md",
    "sources": [
      "devflow/functional/user-stories/US-000-non-functional.md",
      "devflow/reviews/REV-004-kit-self-containment-consistency-audit.md",
      "devflow/adrs/ADR-004-repository-partition-v2.md"
    ],
    "generation": {
      "created_at": "2026-08-23T00:44:14-03:00",
      "created_by": "human:eugenio.serrano",
      "runs": [],
      "duration_seconds": null
    },
    "review_ready_at": "2026-08-23T00:44:14-03:00",
    "review_started_at": "2026-08-23T00:51:05-03:00",
    "acceptance": {
      "review_ready_at": "2026-08-23T01:18:50-03:00",
      "review_started_at": "2026-08-23T01:18:50-03:00"
    }
  },
  "spec_revisions": [
    {
      "revision": 1,
      "ref": "devflow/spec/SPEC-260823-0051-kit-self-containment.md",
      "sources": [
        "devflow/functional/bolts/US-000.BOLT-011-kit-self-containment.md",
        "devflow/reviews/REV-004-kit-self-containment-consistency-audit.md",
        "devflow/adrs/ADR-004-repository-partition-v2.md"
      ],
      "git_commit": null,
      "generation": {
        "created_at": "2026-08-23T00:51:46-03:00",
        "created_by": "human:eugenio.serrano",
        "runs": [],
        "duration_seconds": null
      },
      "review_ready_at": "2026-08-23T00:51:46-03:00",
      "review_started_at": "2026-08-23T00:54:35-03:00"
    }
  ],
  "v_bounces": [
    {
      "number": 1,
      "spec_revision": 1,
      "git_commit": null,
      "execution_outcome": "ready_for_review",
      "code_generation": {
        "created_at": "2026-08-23T00:58:30-03:00",
        "created_by": "human:eugenio.serrano",
        "runs": [],
        "duration_seconds": null
      },
      "mem": {
        "ref": "devflow/memory/MEM-260823-0058-kit-self-containment.md",
        "generation": {
          "created_at": "2026-08-23T00:58:30-03:00",
          "created_by": "human:eugenio.serrano",
          "runs": [],
          "duration_seconds": null
        }
      },
      "review_ready_at": "2026-08-23T00:58:30-03:00",
      "review_started_at": "2026-08-23T01:10:54-03:00"
    }
  ],
  "checkpoint_approvals": [
    {
      "checkpoint": "AITL-BOLT-READY-Approval",
      "subject": {
        "ref": "devflow/functional/bolts/US-000.BOLT-011-kit-self-containment.md"
      },
      "decision": "approved",
      "decided_by": [
        {
          "actor": "human:eugenio.serrano",
          "role": "tech_lead",
          "model": null
        }
      ],
      "decided_at": "2026-08-23T00:51:05-03:00",
      "comment": "DoR met (REV-004 F-01 approved, ADR-004 accepted, 0 open OQ, completion evidence defined); risk low confirmed. ADR-010 mechanism choice delegated to the SPEC (drop citations preferred; maintainer confirms at SPEC review). SPEC preparation authorized."
    },
    {
      "checkpoint": "AITL-SPEC-Approval",
      "subject": {
        "ref": "devflow/spec/SPEC-260823-0051-kit-self-containment.md",
        "revision": 1
      },
      "decision": "approved",
      "decided_by": [
        {
          "actor": "human:eugenio.serrano",
          "role": "dev_validator",
          "model": null
        },
        {
          "actor": "human:eugenio.serrano",
          "role": "tech_lead",
          "model": null
        }
      ],
      "decided_at": "2026-08-23T00:54:35-03:00",
      "comment": "Revision 1 approved: location inventory matches the tree; ADR-010 drop mechanism confirmed (no appendix); ACs objectively checkable; gates n/a reasoned. V-Bounce authorized."
    },
    {
      "checkpoint": "AITL-MEM-Approval",
      "subject": {
        "ref": "devflow/memory/MEM-260823-0058-kit-self-containment.md",
        "v_bounce": 1
      },
      "decision": "approved",
      "decided_by": [
        {
          "actor": "human:eugenio.serrano",
          "role": "dev_validator",
          "model": null
        }
      ],
      "decided_at": "2026-08-23T01:10:54-03:00",
      "comment": "V-Bounce 1 approved: 10-file diff = SPEC-0051 §4 inventory; absence sweeps at zero (US-015/ADR-010/CHANGELOG 4.0/tools-README); G-count 39×5; parity 2 lines/pair; UAT notes informative; report ID-token-only; sequential-overlap note verified (disjoint ranges). Bolt → Development Completed."
    },
    {
      "checkpoint": "AITL-BOLT-DONE-Approval",
      "subject": {
        "ref": "devflow/functional/bolts/US-000.BOLT-011-kit-self-containment.md"
      },
      "decision": "approved",
      "decided_by": [
        {
          "actor": "human:eugenio.serrano",
          "role": "tech_lead",
          "model": null
        }
      ],
      "decided_at": "2026-08-23T01:18:50-03:00",
      "comment": "Accepted (refactor → Tech Lead): before/after diff + verification parity — absence sweeps at zero, UAT notes informative, report ID-token-only, G-count 39×5, parity, kit-only, manifest 0 errors. REV-004 F-01 closed. Bolt Done."
    }
  ]
}
