{
  "schema_version": "5.0",
  "bolt": {
    "id": "US-000.BOLT-016",
    "type": "non-functional",
    "ref": "devflow/functional/bolts/US-000.BOLT-016-hitl-aitl-doc-vocabulary-normalization.md",
    "sources": [
      "devflow/functional/user-stories/US-000-non-functional.md",
      "devflow/avenga-devflow/Avenga-DevFlow.md"
    ],
    "generation": {
      "created_at": "2026-08-23T11:47:50-03:00",
      "created_by": "human:eugenio.serrano",
      "runs": [],
      "duration_seconds": null
    },
    "review_ready_at": "2026-08-23T11:47:50-03:00",
    "review_started_at": "2026-08-23T11:54:10-03:00",
    "acceptance": {
      "review_ready_at": null,
      "review_started_at": null
    }
  },
  "spec_revisions": [],
  "v_bounces": [],
  "checkpoint_approvals": [
    {
      "checkpoint": "AITL-BOLT-READY-Approval",
      "subject": {
        "ref": "devflow/functional/bolts/US-000.BOLT-016-hitl-aitl-doc-vocabulary-normalization.md"
      },
      "decision": "approved",
      "decided_by": [
        { "actor": "human:eugenio.serrano", "role": "tech_lead", "model": null }
      ],
      "decided_at": "2026-08-23T11:54:10-03:00",
      "comment": "DoR met (US-000 active, §5.16 governing, 0 open OQ, scope+exclusions+evidence defined); risk low confirmed. Hard exclusions: MEM/ADR bodies, _archive, recorded facts, framework rule/definition/history. SPEC preparation authorized."
    }
  ]
}
