{
  "schema_version": "5.0",
  "bolt": {
    "id": "US-000.BOLT-017",
    "type": "non-functional",
    "ref": "devflow/functional/bolts/US-000.BOLT-017-english-commit-messages-readme.md",
    "sources": [
      "devflow/functional/user-stories/US-000-non-functional.md",
      "devflow/adrs/ADR-011-english-commit-messages-repository-convention.md",
      "devflow/adrs/ADR-004-repository-partition-v2.md"
    ],
    "generation": {
      "created_at": "2026-08-23T12:24:23-03:00",
      "created_by": "human:eugenio.serrano",
      "runs": [],
      "duration_seconds": null
    },
    "review_ready_at": "2026-08-23T12:24:23-03:00",
    "review_started_at": "2026-08-23T12:32:00-03:00",
    "acceptance": {
      "review_ready_at": "2026-08-23T12:40:00-03:00",
      "review_started_at": "2026-08-23T12:40:41-03:00"
    }
  },
  "spec_revisions": [
    {
      "revision": 1,
      "ref": "devflow/spec/SPEC-260823-1232-english-convention-readme.md",
      "sources": [
        "devflow/functional/bolts/US-000.BOLT-017-english-commit-messages-readme.md",
        "devflow/adrs/ADR-012-english-all-methodology-artifacts-convention.md",
        "devflow/adrs/ADR-011-english-commit-messages-repository-convention.md"
      ],
      "git_commit": null,
      "generation": {
        "created_at": "2026-08-23T12:32:05-03:00",
        "created_by": "human:eugenio.serrano",
        "runs": [],
        "duration_seconds": null
      },
      "review_ready_at": "2026-08-23T12:32:05-03:00",
      "review_started_at": "2026-08-23T12:33:20-03:00"
    }
  ],
  "v_bounces": [
    {
      "number": 1,
      "spec_revision": 1,
      "git_commit": null,
      "execution_outcome": "ready_for_review",
      "code_generation": {
        "created_at": "2026-08-23T12:33:58-03:00",
        "created_by": "human:eugenio.serrano",
        "runs": [],
        "duration_seconds": null
      },
      "mem": {
        "ref": "devflow/memory/MEM-260823-1233-english-convention-readme.md",
        "generation": {
          "created_at": "2026-08-23T12:33:58-03:00",
          "created_by": "human:eugenio.serrano",
          "runs": [],
          "duration_seconds": null
        }
      },
      "review_ready_at": "2026-08-23T12:33:58-03:00",
      "review_started_at": "2026-08-23T12:40:30-03:00"
    }
  ],
  "checkpoint_approvals": [
    {
      "checkpoint": "AITL-BOLT-READY-Approval",
      "subject": {
        "ref": "devflow/functional/bolts/US-000.BOLT-017-english-commit-messages-readme.md"
      },
      "decision": "approved",
      "decided_by": [
        {
          "actor": "human:eugenio.serrano",
          "role": "tech_lead",
          "model": null
        }
      ],
      "decided_at": "2026-08-23T12:32:00-03:00",
      "comment": "DoR met: US-000 active, ADR-012/011/004 accepted, 0 open OQ (G35), completion evidence defined, scope = one sentence in the root README. Risk low confirmed. SPEC preparation authorized."
    },
    {
      "checkpoint": "AITL-SPEC-Approval",
      "subject": {
        "ref": "devflow/spec/SPEC-260823-1232-english-convention-readme.md",
        "revision": 1
      },
      "decision": "approved",
      "decided_by": [
        {
          "actor": "human:eugenio.serrano",
          "role": "dev_validator",
          "model": null
        }
      ],
      "decided_at": "2026-08-23T12:33:20-03:00",
      "comment": "Revision 1 approved: evidence gate clean (Bolt approved, ADRs accepted, 0 open OQ), target sentence + placement exact, commands deterministic, stop conditions defined. V-Bounce authorized."
    },
    {
      "checkpoint": "AITL-MEM-Approval",
      "subject": {
        "ref": "devflow/memory/MEM-260823-1233-english-convention-readme.md",
        "v_bounce": 1
      },
      "decision": "approved",
      "decided_by": [
        {
          "actor": "human:eugenio.serrano",
          "role": "dev_validator",
          "model": null
        }
      ],
      "decided_at": "2026-08-23T12:40:30-03:00",
      "comment": "V-Bounce 1 approved: README diff (single hunk +3) inspected, RED (R1/R2) before edit, GREEN (G1-G4) all pass, gates pass/n-a, manifest v_bounces[1] complete. Bolt → Development Completed."
    },
    {
      "checkpoint": "AITL-BOLT-DONE-Approval",
      "subject": {
        "ref": "devflow/functional/bolts/US-000.BOLT-017-english-commit-messages-readme.md"
      },
      "decision": "approved",
      "decided_by": [
        {
          "actor": "human:eugenio.serrano",
          "role": "tech_lead",
          "model": null
        }
      ],
      "decided_at": "2026-08-23T12:40:41-03:00",
      "comment": "Accepted (refactor → Tech Lead): language-convention sentence in the root README verified (single hunk +3, ADR-011/ADR-012 refs), RED/GREEN evidence, MEM-260823-1233 approved, manifest complete (4 checkpoints + v_bounces[1]). Bolt Done."
    }
  ]
}
